<?xml version="1.0" encoding="UTF-8"?>
<questions xmlns:xsi="http://www.w3.org/2001/XMLSchema-instance" xsi:noNamespaceSchemaLocation="preguntas.xsd">

<question id="preg1">
<type>texto</type>
<title>Pregunta Asignatura</title>
<text>Cómo se llama esta asignatura?</text>
<answer>Lenguaje de Marcas y Sistemas de Gestión de la Información</answer>
</question>

<question id="preg2">
<type>select</type>
<title>Número de archivos</title>
<text> Cuántos archivos tiene esta entrega? </text>
<option>1</option>
<option>2</option>
<option>3</option>
<answer>1</answer>
</question>

<question id="preg3">
<type>select</type>
<title>Fichero html</title>
<text> Es posible abrir un fichero .html en Google chrome?</text>
<option>No</option>
<option>Sí</option>
<answer>1</answer>
</question>

<question id="preg4">
<type>texto</type>
<title>web</title>
<text> Cómo se llama la web dónde colgamos las tareaS?</text>
<answer> www.github.com </answer>
</question>

<question id='preg5'>
<type>radio</type>
<title> suma </title>
<text> Cúanto son 2+2? </text>
<option> 4 </option>
<option> 3 </option>
<answer> 0 </answer>
</question>

<question id="preg6">
<type>checkbox</type>
<title>múltiple</title>
<text>Marca los distintos archivos vistos en esta asignatura </text>
<option>html</option>
<option>mp3</option>
<option>js</option>
<option>iso</option>
<answer>0</answer>
<answer>2</answer>
</question>

<question id="preg7">
<type>checkbox</type>
<title>Selecciona una o más</title>
<text>Cual de los siguientes archivos puede crearse funcionalmente sin necesidad de otro?</text>
<option>.js</option>
<option>.hmtl</option>
<option>.xml</option>
<option>.xsd</option>
<answer>1</answer>
<answer>2</answer>
</question>

<question id='preg8'>
<type>radio</type>
<title> XML </title>
<text> Qué quiere decir XML? </text>
<option> eXtensible Markup Language </option>
<option> eXtensible Meta Language </option>
<option> eXpansible Markup Language</option>
<answer> 0 </answer>
</question>

<question id='preg9'>
<type>number</type>
<title>año</title>
<text>En qué año estamos? </text>
<answer> 2017 </answer>
</question>

<question id='preg10'>
<type>number</type>
<title>FP</title>
<text>Cuántos años dura este FP a distancia?</text>
<answer> 2 </answer>
</question>

</questions>
